dbn,school_name,num_of_sat_test_takers,sat_critical_reading_avg_score,sat_math_avg_score,sat_writing_avg_score,pct_students_tested,academic_tier_rating,sat_avg_total_score,sat_sum_total_score
01M292,HENRY STREET SCHOOL FOR INTERNATIONAL STUDIES,29,355,404,363,78,2,374,1122
01M448,UNIVERSITY NEIGHBORHOOD HIGH SCHOOL,91,383,423,366,,3,391,1172
01M450,EAST SIDE COMMUNITY SCHOOL,70,377,402,370,,3,383,1149
01M458,FORSYTH SATELLITE ACADEMY,7,414,401,359,92,4,391,1174
01M509,MARTA VALLE HIGH SCHOOL,44,390,433,384,92,2,402,1207
01M515,LOWER EAST SIDE PREPARATORY HIGH SCHOOL,112,332,557,316,,3,402,1205
01M539,"NEW EXPLORATIONS INTO SCIENCE, TECHNOLOGY AND MATH HIGH SCHOOL",159,522,574,525,78,2,540,1621
01M650,CASCADES HIGH SCHOOL,18,417,418,411,92,4,415,1246
01M696,BARD HIGH SCHOOL EARLY COLLEGE,130,624,604,628,,,619,1856
02M047,47 THE AMERICAN SIGN LANGUAGE AND ENGLISH SECONDARY SCHOOL,16,395,400,387,78,4,394,1182
02M288,FOOD AND FINANCE HIGH SCHOOL,62,409,393,392,92,,398,1194
02M294,ESSEX STREET ACADEMY,53,394,384,378,78,4,385,1156
02M296,HIGH SCHOOL OF HOSPITALITY MANAGEMENT,58,374,375,362,92,3,370,1111
02M298,PACE HIGH SCHOOL,85,423,438,432,78,2,431,1293
02M300,"URBAN ASSEMBLY SCHOOL OF DESIGN AND CONSTRUCTION, THE",48,404,449,416,92,,423,1269
02M303,"FACING HISTORY SCHOOL, THE",76,353,358,340,,,350,1051
02M305,"URBAN ASSEMBLY ACADEMY OF GOVERNMENT AND LAW, THE",50,375,388,385,85,,383,1148
02M308,LOWER MANHATTAN ARTS ACADEMY,40,403,392,405,,4,400,1200
02M313,"JAMES BALDWIN SCHOOL, THE: A SCHOOL FOR EXPEDITIONARY LEARNING",69,408,390,390,,2,396,1188
02M316,"URBAN ASSEMBLY SCHOOL OF BUSINESS FOR YOUNG WOMEN, THE",42,373,370,384,92,,376,1127
02M374,GRAMERCY ARTS HIGH SCHOOL,60,391,391,394,85,,392,1176
02M376,NYC ISCHOOL,92,473,483,479,78,4,478,1435
02M392,MANHATTAN BUSINESS ACADEMY,,,,,85,,,0
02M393,BUSINESS OF SPORTS SCHOOL,,,,,,2,,0
02M394,EMMA LAZARUS HIGH SCHOOL,79,319,512,357,78,2,396,1188
02M399,THE HIGH SCHOOL FOR LANGUAGE AND DIPLOMACY,,,,,85,,,0
02M400,HIGH SCHOOL FOR ENVIRONMENTAL STUDIES,263,465,493,461,,2,473,1419
02M407,INSTITUTE FOR COLLABORATIVE EDUCATION,54,492,465,467,85,,475,1424
02M408,PROFESSIONAL PERFORMING ARTS HIGH SCHOOL,94,509,490,523,92,1,507,1522
02M411,BARUCH COLLEGE CAMPUS HIGH SCHOOL,104,496,563,518,,3,526,1577
02M412,N.Y.C. LAB SCHOOL FOR COLLABORATIVE STUDIES,114,537,590,550,92,4,559,1677
02M413,SCHOOL OF THE FUTURE HIGH SCHOOL,66,517,533,515,85,3,522,1565
02M414,N.Y.C. MUSEUM SCHOOL,103,468,492,459,92,1,473,1419
02M416,ELEANOR ROOSEVELT HIGH SCHOOL,127,572,594,592,92,2,586,1758
02M418,MILLENNIUM HIGH SCHOOL,144,528,553,533,85,2,538,1614
02M419,LANDMARK HIGH SCHOOL,62,390,399,381,78,2,390,1170
02M420,HIGH SCHOOL FOR HEALTH PROFESSIONS AND HUMAN SERVICES,336,429,449,428,92,3,435,1306
02M425,LEADERSHIP AND PUBLIC SERVICE HIGH SCHOOL,84,416,426,391,92,4,411,1233
02M427,MANHATTAN ACADEMY FOR ARTS & LANGUAGE,,,,,,4,,0
02M429,LEGACY SCHOOL FOR INTEGRATED STUDIES,29,356,357,349,92,1,354,1062
02M437,HUDSON HIGH SCHOOL OF LEARNING TECHNOLOGIES,,,,,,2,,0
02M438,INTERNATIONAL HIGH SCHOOL AT UNION SQUARE,,,,,78,1,,0
02M439,MANHATTAN VILLAGE ACADEMY,95,441,473,458,85,1,457,1372
02M440,BAYARD RUSTIN EDUCATIONAL COMPLEX,59,378,365,368,92,2,370,1111
02M449,VANGUARD HIGH SCHOOL,72,395,416,388,85,4,400,1199
02M459,MANHATTAN INTERNATIONAL HIGH SCHOOL,49,376,460,391,85,3,409,1227
02M460,WASHINGTON IRVING HIGH SCHOOL,151,373,387,360,78,3,373,1120
02M473,WASHINGTON IRVING YABC,,,,,92,3,,0
02M475,STUYVESANT HIGH SCHOOL,832,679,735,682,,4,699,2096
02M489,HIGH SCHOOL OF ECONOMICS AND FINANCE,167,443,489,442,92,4,458,1374
02M500,UNITY CENTER FOR URBAN TECHNOLOGIES,25,370,349,351,,,357,1070
02M519,TALENT UNLIMITED HIGH SCHOOL,81,469,472,475,,,472,1416
02M520,MURRY BERGTRAUM HIGH SCHOOL FOR BUSINESS CAREERS,264,407,440,393,92,2,413,1240
02M529,JACQUELINE KENNEDY ONASSIS HIGH SCHOOL,131,414,425,400,85,4,413,1239
02M531,REPERTORY COMPANY HIGH SCHOOL FOR THEATRE ARTS,42,429,404,420,,,418,1253
02M542,MANHATTAN BRIDGES HIGH SCHOOL,66,336,378,344,85,,353,1058
02M543,NEW DESIGN HIGH SCHOOL,73,391,395,382,78,2,389,1168
02M544,INDEPENDENCE HIGH SCHOOL,14,389,371,335,85,3,365,1095
02M545,HIGH SCHOOL FOR DUAL LANGUAGE AND ASIAN STUDIES,78,412,581,431,78,1,475,1424
02M550,LIBERTY HIGH SCHOOL ACADEMY FOR NEWCOMERS,26,368,436,352,78,4,385,1156
02M551,THE URBAN ASSEMBLY NEW YORK HARBOR SCHOOL,77,405,423,384,92,3,404,1212
02M560,HIGH SCHOOL M560 s CITY AS SCHOOL,56,498,440,477,85,4,472,1415
02M565,URBAN ACADEMY LABORATORY HIGH SCHOOL,30,527,508,512,85,4,516,1547
02M570,SATELLITE ACADEMY HIGH SCHOOL,33,350,337,345,85,1,344,1032
02M575,MANHATTAN COMPREHENSIVE NIGHT AND DAY HIGH SCHOOL,121,345,517,343,78,1,402,1205
02M580,RICHARD R. GREEN HIGH SCHOOL OF TEACHING,84,408,384,403,,4,398,1195
02M586,HARVEY MILK HIGH SCHOOL,9,458,416,429,85,4,434,1303
02M600,THE HIGH SCHOOL OF FASHION INDUSTRIES,335,423,423,411,78,1,419,1257
02M605,HUMANITIES PREPARATORY ACADEMY,36,426,403,426,,1,418,1255
02M615,CHELSEA CAREER AND TECHNICAL EDUCATION HIGH SCHOOL,83,399,418,390,92,4,402,1207
02M620,NORMAN THOMAS HIGH SCHOOL,154,370,379,359,,,369,1108
02M625,HIGH SCHOOL OF GRAPHIC COMMUNICATION ARTS,191,395,382,376,,2,384,1153
02M630,ART AND DESIGN HIGH SCHOOL,270,444,441,430,85,,438,1315
02M655,LIFE SCIENCES SECONDARY SCHOOL,61,409,424,403,92,2,412,1236
03M283,MANHATTAN THEATRE LAB HIGH SCHOOL,27,406,379,408,85,3,398,1193
03M299,"HIGH SCHOOL FOR ARTS, IMAGINATION AND INQUIRY",49,374,384,374,,1,377,1132
03M307,"URBAN ASSEMBLY SCHOOL FOR MEDIA STUDIES, THE",41,384,390,370,78,4,381,1144
03M402,THE URBAN ASSEMBLY SCHOOL FOR GREEN CAREERS,,,,,78,3,,0
03M403,THE GLOBAL LEARNING COLLABORATIVE,,,,,78,1,,0
03M404,INNOVATION DIPLOMA PLUS,12,416,403,381,92,4,400,1200
03M415,WADLEIGH SECONDARY SCHOOL FOR THE PERFORMING & VISUAL ARTS,32,371,,370,78,4,370,741
03M417,FRANK MCCOURT HIGH SCHOOL,,,,,85,4,,0
03M470,LOUIS D. BRANDEIS HIGH SCHOOL,131,370,390,358,,4,373,1118
03M479,BEACON HIGH SCHOOL,261,577,575,592,92,2,581,1744
03M485,FIORELLO H. LAGUARDIA HIGH SCHOOL OF MUSIC & ART AND PERFORMING ARTS,531,566,564,577,92,3,569,1707
03M492,"HIGH SCHOOL FOR LAW, ADVOCACY AND COMMUNITY JUSTICE",66,396,398,402,92,2,399,1196
03M494,HIGH SCHOOL OF ARTS AND TECHNOLOGY,75,433,433,411,85,1,426,1277
03M505,EDWARD A. REYNOLDS WEST SIDE HIGH SCHOOL,35,401,369,351,92,3,374,1121
03M541,MANHATTAN / HUNTER SCIENCE HIGH SCHOOL,111,473,506,467,78,2,482,1446
03M577,YOUNG ADULT BOROUGH CENTER AT LOUIS D. BRANDEIS HS,,,,,85,2,,0
03M860,FREDERICK DOUGLASS ACADEMY II SECONDARY SCHOOL,43,356,379,361,92,2,365,1096
04M409,COALITION SCHOOL FOR SOCIAL CHANGE,48,354,357,373,92,3,361,1084
04M435,MANHATTAN CENTER FOR SCIENCE AND MATHEMATICS,375,461,514,455,85,1,477,1430
04M495,PARK EAST HIGH SCHOOL,51,373,379,376,,2,376,1128
04M555,CENTRAL PARK EAST HIGH SCHOOL,73,405,421,395,78,2,407,1221
04M610,YOUNG WOMEN'S LEADERSHIP SCHOOL,70,432,446,448,92,1,442,1326
04M635,ACADEMY OF ENVIRONMENTAL SCIENCE SECONDARY HIGH SCHOOL,48,369,369,357,92,2,365,1095
04M680,"HERITAGE SCHOOL, THE",31,358,351,345,78,3,351,1054
05M285,HARLEM RENAISSANCE HIGH SCHOOL,29,357,318,333,92,3,336,1008
05M304,MOTT HALL HIGH SCHOOL,54,413,399,398,78,2,403,1210
05M362,"COLUMBIA SECONDARY SCHOOL FOR MATH, SCIENCE, AND ENGINEERING",,,,,,4,,0
05M367,ACADEMY FOR SOCIAL ACTION: A COLLEGE BOARD SCHOOL,33,354,366,342,78,3,354,1062
05M369,URBAN ASSEMBLY SCHOOL FOR THE PERFORMING ARTS,56,360,353,364,85,3,359,1077
05M469,CHOIR ACADEMY OF HARLEM,20,354,360,385,85,4,366,1099
05M499,FREDERICK DOUGLASS ACADEMY,214,458,474,442,92,1,458,1374
05M670,THURGOOD MARSHALL ACADEMY FOR LEARNING AND SOCIAL CHANGE,66,396,402,404,92,3,401,1202
05M685,BREAD & ROSES INTEGRATED ARTS HIGH SCHOOL,61,369,361,355,,,362,1085
05M692,"HIGH SCHOOL FOR MATHEMATICS, SCIENCE AND ENGINEERING AT CITY COLLEGE",101,605,654,588,78,1,616,1847
06M293,CITY COLLEGE ACADEMY OF THE ARTS,60,408,446,416,,3,423,1270
06M346,COMMUNITY HEALTH ACADEMY OF THE HEIGHTS,55,362,376,367,,2,368,1105
06M348,WASHINGTON HEIGHTS EXPEDITIONARY LEARNING SCHOOL,70,380,395,399,78,1,391,1174
06M423,HIGH SCHOOL FOR EXCELLENCE AND INNOVATION,,,,,92,,,0
06M457,GEORGE WASHINGTON YABC,7,394,357,346,92,4,366,1097
06M462,HIGH SCHOOL FOR INTERNATIONAL BUSINESS AND FINANCE,76,365,384,378,,,376,1127
06M463,HIGH SCHOOL FOR MEDIA AND COMMUNICATIONS,63,369,380,349,92,3,366,1098
06M467,HIGH SCHOOL FOR LAW AND PUBLIC SERVICE,94,363,378,361,78,2,367,1102
06M468,HIGH SCHOOL FOR HEALTH CAREERS AND SCIENCES,24,400,422,402,78,1,408,1224
06M540,A. PHILIP RANDOLPH CAMPUS HIGH SCHOOL,228,430,456,423,78,3,436,1309
06M552,GREGORIO LUPERON HIGH SCHOOL FOR SCIENCE AND MATHEMATICS,56,339,349,326,78,2,338,1014
07X221,SOUTH BRONX PREPARATORY: A COLLEGE BOARD SCHOOL,65,364,378,348,92,,363,1090
07X321,CROTONA ACADEMY HIGH SCHOOL,9,379,364,382,92,4,375,1125
07X334,INTERNATIONAL COMMUNITY HIGH SCHOOL,34,310,324,311,85,4,315,945
07X379,JILL CHAIFETZ TRANSFER HIGH SCHOOL,,,,,92,,,0
07X381,BRONX HAVEN HIGH SCHOOL,,,,,78,4,,0
07X427,COMMUNITY SCHOOL FOR SOCIAL JUSTICE,43,361,359,357,92,1,359,1077
07X473,MOTT HAVEN VILLAGE PREPARATORY HIGH SCHOOL,63,351,375,371,78,1,366,1097
07X495,UNIVERSITY HEIGHTS SECONDARY SCHOOL,79,403,394,404,85,3,400,1201
07X500,HOSTOSsLINCOLN ACADEMY OF SCIENCE,66,420,426,411,85,2,419,1257
07X520,FOREIGN LANGUAGE ACADEMY OF GLOBAL STUDIES,64,399,396,391,,3,395,1186
07X527,BRONX LEADERSHIP ACADEMY II HIGH SCHOOL,62,362,378,363,,4,368,1103
07X547,NEW EXPLORERS HIGH SCHOOL,28,367,356,361,92,,361,1084
07X548,URBAN ASSEMBLY SCHOOL FOR CAREERS IN SPORTS,44,387,411,383,,2,394,1181
07X551,BRONX ACADEMY OF LETTERS,51,413,381,407,92,3,400,1201
07X600,ALFRED E. SMITH CAREER AND TECHNICAL EDUCATION HIGH SCHOOL,76,394,400,364,78,1,386,1158
07X655,SAMUEL GOMPERS CAREER AND TECHNICAL EDUCATION HIGH SCHOOL,47,398,416,370,,1,395,1184
07X670,HEALTH OPPORTUNITIES HIGH SCHOOL,114,363,368,364,85,,365,1095
08X269,BRONX STUDIO SCHOOL FOR WRITERS AND ARTISTS,,,,,92,,,0
08X282,WOMEN'S ACADEMY OF EXCELLENCE,44,407,386,378,,2,390,1171
08X293,RENAISSANCE HIGH SCHOOL FOR MUSICAL THEATER & TECHNOLOGY,52,384,385,389,78,2,386,1158
08X295,GATEWAY SCHOOL FOR ENVIRONMENTAL RESEARCH AND TECHNOLOGY,41,416,390,394,78,,400,1200
08X305,PABLO NERUDA ACADEMY FOR ARCHITECTURE AND WORLD STUDIES,67,337,361,340,78,2,346,1038
08X312,MILLENNIUM ART ACADEMY,67,387,402,375,78,1,388,1164
08X332,HOLCOMBE L. RUCKER SCHOOL OF COMMUNITY RESEARCH,39,363,371,350,78,1,361,1084
08X367,"ARCHIMEDES ACADEMY FOR MATH, SCIENCE AND TECHNOLOGY APPLICATIONS",,,,,85,1,,0
08X376,"ANTONIA PANTOJA PREPARATORY ACADEMY, A COLLEGE BOARD SCHOOL",,,,,,3,,0
08X377,BRONX COMMUNITY HIGH SCHOOL,9,367,369,376,,,371,1112
08X405,HERBERT H. LEHMAN HIGH SCHOOL,415,412,436,393,92,2,414,1241
08X408,HERBERT H. LEHMAN YABC,6,402,373,413,85,2,396,1188
08X432,BRONX BRIDGES HIGH SCHOOL,,,,,78,1,,0
08X452,BRONX GUILD,39,369,371,365,,1,368,1105
08X507,STEVENSON YABC,,,,,85,,,0
08X519,"FELISA RINCON DE GAUTIER INSTITUTE FOR LAW AND PUBLIC POLICY, THE",68,373,370,356,,3,366,1099
08X530,BANANA KELLY HIGH SCHOOL,54,373,381,377,92,3,377,1131
08X537,BRONX ARENA HIGH SCHOOL,,,,,78,2,,0
08X540,SCHOOL FOR COMMUNITY RESEARCH AND LEARNING,16,366,400,368,78,4,378,1134
08X560,HIGH SCHOOL X560 s BRONX ACADEMY HIGH SCHOOL,9,404,368,399,78,2,390,1171
08X650,JANE ADDAMS HIGH SCHOOL FOR ACADEMIC CAREERS,78,377,359,376,78,,371,1112
09X227,BRONX EXPEDITIONARY LEARNING HIGH SCHOOL,39,324,376,349,92,,350,1049
09X231,EAGLE ACADEMY FOR YOUNG MEN,78,373,387,374,78,4,378,1134
09X239,"URBAN ASSEMBLY ACADEMY FOR HISTORY AND CITIZENSHIP FOR YOUNG MEN, THE",33,372,355,357,85,4,361,1084
09X241,"URBAN ASSEMBLY SCHOOL FOR APPLIED MATH AND SCIENCE, THE",80,411,464,415,85,2,430,1290
09X250,EXIMIUS COLLEGE PREPARATORY ACADEMY: A COLLEGE BOARD SCHOOL,50,393,394,382,78,4,390,1169
09X252,MOTT HALL BRONX HIGH SCHOOL,67,369,367,356,85,4,364,1092
09X260,BRONX CENTER FOR SCIENCE AND MATHEMATICS,81,459,480,457,85,,465,1396
09X263,VALIDUS PREPARATORY ACADEMY: AN EXPEDITIONARY LEARNING SCHOOL,74,356,363,356,92,,358,1075
09X276,LEADERSHIP INSTITUTE,30,361,353,367,85,3,360,1081
09X297,MORRIS ACADEMY FOR COLLABORATIVE STUDIES,38,386,386,376,92,1,383,1148
09X324,BRONX EARLY COLLEGE ACADEMY FOR TEACHING & LEARNING,,,,,85,3,,0
09X329,DREAMYARD PREPARATORY SCHOOL,51,382,365,391,85,4,379,1138
09X365,ACADEMY FOR LANGUAGE AND TECHNOLOGY,54,315,339,297,,1,317,951
09X403,BRONX INTERNATIONAL HIGH SCHOOL,49,314,312,339,78,4,322,965
09X404,SCHOOL FOR EXCELLENCE,32,363,360,351,85,2,358,1074
09X412,BRONX HIGH SCHOOL OF BUSINESS,34,356,376,351,85,1,361,1083
09X413,BRONX HIGH SCHOOL FOR MEDICAL SCIENCE,64,400,419,402,92,4,407,1221
09X414,JONATHAN LEVIN HIGH SCHOOL FOR MEDIA AND COMMUNICATIONS,35,379,364,379,85,2,374,1122
09X505,"BRONX SCHOOL FOR LAW, GOVERNMENT AND JUSTICE",80,404,418,402,,4,408,1224
09X517,FREDERICK DOUGLASS ACADEMY III SECONDARY SCHOOL,50,368,384,369,85,3,374,1121
09X525,BRONX LEADERSHIP ACADEMY HIGH SCHOOL,114,384,394,388,92,1,389,1166
09X543,HIGH SCHOOL FOR VIOLIN AND DANCE,27,353,315,371,85,,346,1039
10X141,RIVERDALE / KINGSBRIDGE ACADEMY (MIDDLE SCHOOL / HIGH SCHOOL 141),113,438,455,440,78,,444,1333
10X213,BRONX ENGINEERING AND TECHNOLOGY ACADEMY,86,373,412,365,,4,383,1150
10X225,THEATRE ARTS PRODUCTION COMPANY SCHOOL,59,405,,394,78,,400,799
10X237,"THE MARIE CURIE SCHOOL FOR MEDICINE, NURSING, AND HEALTH PROFESSIONS",79,382,393,382,78,1,386,1157
10X243,WEST BRONX ACADEMY FOR THE FUTURE,26,382,406,370,92,2,386,1158
10X268,KINGSBRIDGE INTERNATIONAL HIGH SCHOOL,52,304,356,302,92,2,321,962
10X284,BRONX SCHOOL OF LAW AND FINANCE,54,402,395,385,,2,394,1182
10X319,PROVIDING URBAN LEARNERS SUCCESS IN EDUCATION HIGH SCHOOL,,,,,92,,,0
10X342,INTERNATIONAL SCHOOL FOR LIBERAL ARTS,49,300,333,301,78,,311,934
10X368,INsTECH ACADEMY (M.S. / HIGH SCHOOL 368),111,390,408,383,85,3,394,1181
10X374,KNOWLEDGE AND POWER PREPARATORY ACADEMY INTERNATIONAL HIGH SCHOOL (KAPPA),61,392,401,387,,2,393,1180
10X397,ENGLISH LANGUAGE LEARNERS AND INTERNATIONAL SUPPORT PREPARATORY ACADEMY (ELLIS),38,343,356,330,78,,343,1029
10X433,HIGH SCHOOL FOR TEACHING AND THE PROFESSIONS,57,370,371,365,85,1,369,1106
10X434,BELMONT PREPARATORY HIGH SCHOOL,51,404,418,400,78,,407,1222
10X437,FORDHAM HIGH SCHOOL FOR THE ARTS,48,355,350,372,85,,359,1077
10X438,FORDHAM LEADERSHIP ACADEMY FOR BUSINESS AND TECHNOLOGY,63,367,385,367,78,4,373,1119
10X439,BRONX HIGH SCHOOL FOR LAW AND COMMUNITY SERVICE,65,366,364,352,,2,361,1082
10X440,DEWITT CLINTON HIGH SCHOOL,443,419,426,410,85,,418,1255
10X442,"CELIA CRUZ BRONX HIGH SCHOOL OF MUSIC, THE",52,423,420,427,,1,423,1270
10X445,BRONX HIGH SCHOOL OF SCIENCE,731,632,688,649,,,656,1969
10X475,JOHN F. KENNEDY HIGH SCHOOL,109,351,362,339,78,3,351,1052
10X477,MARBLE HILL HIGH SCHOOL FOR INTERNATIONAL STUDIES,99,414,435,414,78,3,421,1263
10X478,LEARNING TO WORK GED AT JOHN F. KENNEDY,,,,,85,,,0
10X546,BRONX THEATRE HIGH SCHOOL,68,348,362,354,78,4,355,1064
10X549,DISCOVERY HIGH SCHOOL,55,372,379,364,,,372,1115
10X660,GRACE DODGE CAREER AND TECHNICAL EDUCATION HIGH SCHOOL,73,362,382,356,85,,367,1100
10X667,GRACE DODGE YABC,10,350,356,317,,4,341,1023
10X696,HIGH SCHOOL OF AMERICAN STUDIES AT LEHMAN COLLEGE,92,636,648,636,,1,640,1920
11X249,BRONX HEALTH SCIENCES HIGH SCHOOL,74,370,381,382,,4,378,1133
11X253,BRONX HIGH SCHOOL FOR WRITING AND COMMUNICATION ARTS,46,400,357,390,,3,382,1147
11X265,BRONX LAB SCHOOL,81,377,391,367,78,4,378,1135
11X270,ACADEMY FOR SCHOLARSHIP AND ENTREPRENEURSHIP: A COLLEGE BOARD SCHOOL,56,386,394,361,85,3,380,1141
11X275,HIGH SCHOOL OF COMPUTERS AND TECHNOLOGY,72,381,376,354,,3,370,1111
11X288,COLLEGIATE INSTITUTE FOR MATH AND SCIENCE,97,444,471,433,92,3,449,1348
11X290,BRONX ACADEMY OF HEALTH CAREERS,69,387,365,383,78,4,378,1135
11X299,ASTOR COLLEGIATE ACADEMY,60,387,391,391,92,,390,1169
11X415,CHRISTOPHER COLUMBUS HIGH SCHOOL,121,367,361,353,,,360,1081
11X417,YOUNG ADULT BOROUGH CNTR CHRISTOPHER COLUMBUS HS,,,,,92,4,,0
11X418,BRONX HIGH SCHOOL FOR THE VISUAL ARTS,48,419,433,416,78,,423,1268
11X455,HARRY S TRUMAN HIGH SCHOOL,189,386,397,368,78,1,384,1151
11X456,LEARNING TO WORK YABC AT TRUMAN HIGH SCHOOL,,,,,,4,,0
11X513,NEW WORLD HIGH SCHOOL,72,332,381,335,78,3,349,1048
11X514,THE BRONXWOOD PREPARATORY ACADEMY,48,377,372,363,85,2,371,1112
11X541,GLOBAL ENTERPRISE HIGH SCHOOL,57,372,382,375,85,4,376,1129
11X542,PELHAM PREPARATORY ACADEMY,76,431,438,419,,2,429,1288
11X544,HIGH SCHOOL FOR CONTEMPORARY ARTS,55,383,378,365,92,4,375,1126
11X545,BRONX AEROSPACE HIGH SCHOOL,46,388,393,382,,2,388,1163
12X245,NEW DAY ACADEMY,25,348,344,354,85,2,349,1046
12X248,"METROPOLITAN HIGH SCHOOL, THE",49,347,367,341,85,1,352,1055
12X251,EXPLORATIONS ACADEMY,57,381,381,360,,2,374,1122
12X262,PERFORMANCE CONSERVATORY HIGH SCHOOL,30,361,353,360,85,,358,1074
12X267,BRONX LATIN,36,408,432,411,85,1,417,1251
12X271,EAST BRONX ACADEMY FOR THE FUTURE,46,366,378,358,,3,367,1102
12X278,PEACE AND DIVERSITY ACADEMY,34,390,401,364,85,3,385,1155
12X388,PAN AMERICAN INTERNATIONAL HIGH SCHOOL AT MONROE,30,321,351,298,85,3,323,970
12X428,LEARNING TO WORK YABC AT MONROE ACADEMY,,,,,92,,,0
12X446,ARTURO A. SCHOMBURG SATELLITE ACADEMY BRONX,14,380,372,349,78,4,367,1101
12X478,THE CINEMA SCHOOL,,,,,85,,,0
12X479,BRONX CAREER AND COLLEGE PREPARATORY HIGH SCHOOL,,,,,85,1,,0
12X480,BRONX REGIONAL HIGH SCHOOL,16,398,385,398,,3,394,1181
12X550,HIGH SCHOOL OF WORLD CULTURES,42,304,323,312,85,3,313,939
12X682,FANNIE LOU HAMER FREEDOM HIGH SCHOOL,72,342,346,341,,3,343,1029
12X684,WINGS ACADEMY,66,378,374,362,,,371,1114
12X690,MONROE ACADEMY FOR BUSINESS/LAW,31,375,387,376,92,2,379,1138
12X692,MONROE ACADEMY FOR VISUAL ARTS & DESIGN,43,332,357,349,,2,346,1038
13K265,DR. SUSAN S. MCKINNEY SECONDARY SCHOOL OF THE ARTS,29,352,349,373,,1,358,1074
13K336,ACADEMY OF BUSINESS AND COMMUNITY DEVELOPMENT,9,439,374,418,78,2,410,1231
13K350,URBAN ASSEMBLY HIGH SCHOOL OF MUSIC AND ART,52,360,364,356,78,1,360,1080
13K412,"BROOKLYN COMMUNITY HIGH SCHOOL OF COMMUNICATION, ARTS AND MEDIA",37,375,355,384,78,3,371,1114
13K419,"SCIENCE SKILLS CENTER HIGH SCHOOL FOR SCIENCE, TECHNOLOGY AND THE CREATIVE ARTS",92,399,417,395,92,3,404,1211
13K430,BROOKLYN TECHNICAL HIGH SCHOOL,1277,587,659,587,,4,611,1833
13K439,BROOKLYN INTERNATIONAL HIGH SCHOOL,90,305,364,312,,,327,981
13K483,THE URBAN ASSEMBLY SCHOOL FOR LAW AND JUSTICE,105,400,417,389,92,2,402,1206
13K499,ACORN COMMUNITY HIGH SCHOOL,72,384,364,368,92,1,372,1116
13K509,FREEDOM ACADEMY HIGH SCHOOL,29,400,390,403,,3,398,1193
13K527,URBAN ASSEMBLY INSTITUTE OF MATH AND SCIENCE FOR YOUNG WOMEN,,,,,78,2,,0
13K553,BROOKLYN ACADEMY HIGH SCHOOL,8,435,383,379,,2,399,1197
13K575,BEDFORD STUYVESANT PREPARATORY HIGH SCHOOL,13,398,391,394,92,1,394,1183
13K595,BEDFORD ACADEMY HIGH SCHOOL,89,438,443,431,85,,437,1312
13K605,GEORGE WESTINGHOUSE CAREER AND TECHNICAL EDUCATION HIGH SCHOOL,85,406,391,392,,,396,1189
13K616,BROOKLYN HIGH SCHOOL FOR LEADERSHIP AND COMMUNITY SERVICE,,,,,85,,,0
13K670,BENJAMIN BANNEKER ACADEMY,185,471,472,448,,3,464,1391
13K674,"CITY POLYTECHNIC HIGH SCHOOL OF ENGINEERING, ARCHITECTURE, AND TECHNOLOGY",20,441,499,413,,1,451,1353
14K071,JUAN MOREL CAMPOS SECONDARY SCHOOL,102,365,361,359,78,4,362,1085
14K322,FOUNDATIONS ACADEMY,,,,,85,,,0
14K404,ACADEMY FOR YOUNG WRITERS,68,387,357,381,78,,375,1125
14K449,"BROOKLYN LATIN SCHOOL, THE",72,586,584,570,78,2,580,1740
14K454,GREEN SCHOOL: AN ACADEMY FOR ENVIRONMENTAL CAREERS,41,407,386,396,,3,396,1189
14K474,PROGRESS HIGH SCHOOL FOR PROFESSIONAL CAREERS,144,364,379,371,78,4,371,1114
14K477,SCHOOL FOR LEGAL STUDIES,134,413,396,395,78,1,401,1204
14K478,"THE HIGH SCHOOL FOR ENTERPRISE, BUSINESS AND TECHNOLOGY",142,398,421,396,78,4,405,1215
14K488,BROOKLYN PREPARATORY HIGH SCHOOL,42,367,373,350,78,4,363,1090
14K558,WILLIAMSBURG HIGH SCHOOL FOR ARCHITECTURE AND DESIGN,72,363,385,364,,4,371,1112
14K561,WILLIAMSBURG PREPARATORY SCHOOL,113,397,410,380,85,2,396,1187
14K586,LYONS COMMUNITY SCHOOL,31,371,377,355,92,1,368,1103
14K610,AUTOMOTIVE HIGH SCHOOL,94,367,376,350,85,3,364,1093
14K632,FRANCES PERKINS ACADEMY,12,382,372,368,78,3,374,1122
14K685,EL PUENTE ACADEMY FOR PEACE AND JUSTICE,28,359,335,341,92,4,345,1035
14K923,AUTOMOTIVE HIGH SCHOOL YABC,,,,,85,,,0
15K429,BROOKLYN SCHOOL FOR GLOBAL STUDIES,52,361,367,383,92,1,370,1111
15K448,BROOKLYN SECONDARY SCHOOL FOR COLLABORATIVE STUDIES,76,393,399,387,,3,393,1179
15K462,SECONDARY SCHOOL FOR LAW,59,398,411,394,,3,401,1203
15K463,SECONDARY SCHOOL FOR JOURNALISM,58,397,391,381,,4,390,1169
15K464,PARK SLOPE COLLEGIATE,72,379,416,380,85,1,392,1175
15K497,SCHOOL FOR INTERNATIONAL STUDIES,64,405,415,392,85,4,404,1212
15K519,COBBLE HILL SCHOOL OF AMERICAN STUDIES,77,398,402,385,,,395,1185
15K520,PACIFIC HIGH SCHOOL,9,352,341,300,92,4,331,993
15K529,WEST BROOKLYN COMMUNITY HIGH SCHOOL,,,,,,4,,0
15K530,METROPOLITAN CORPORATE ACADEMY HIGH SCHOOL,28,368,365,368,85,4,367,1101
15K656,BROOKLYN HIGH SCHOOL OF THE ARTS,141,426,,411,,,418,837
15K667,SUNSET PARK HIGH SCHOOL,,,,,,,,0
15K698,SOUTH BROOKLYN COMMUNITY HIGH SCHOOL,8,430,416,425,92,2,424,1271
16K393,FREDERICK DOUGLASS ACADEMY IV SECONDARY SCHOOL,20,355,355,358,,4,356,1068
16K455,BOYS AND GIRLS HIGH SCHOOL,131,365,370,362,78,4,366,1097
16K498,BROOKLYN HIGH SCHOOL FOR LAW AND TECHNOLOGY,46,362,372,358,78,2,364,1092
16K594,GOTHAM PROFESSIONAL ARTS ACADEMY,36,370,372,351,,2,364,1093
16K688,THE BROOKLYN ACADEMY OF GLOBAL FINANCE,,,,,85,3,,0
17K382,ACADEMY FOR COLLEGE PREPARATION AND CAREER EXPLORATION: A COLLEGE BOARD SCHOOL,59,396,374,369,92,4,380,1139
17K408,ACADEMY OF HOSPITALITY AND TOURISM,57,352,342,351,85,3,348,1045
17K467,ERASMUS YABC,,,,,,4,,0
17K489,W.E.B. DUBOIS ACADEMIC HIGH SCHOOL,7,394,364,334,85,1,364,1092
17K524,INTERNATIONAL HIGH SCHOOL AT PROSPECT HEIGHTS,71,287,335,291,85,,304,913
17K528,THE HIGH SCHOOL FOR GLOBAL CITIZENSHIP,46,403,385,388,,4,392,1176
17K531,"SCHOOL FOR HUMAN RIGHTS, THE",35,348,381,359,85,4,363,1088
17K533,SCHOOL FOR DEMOCRACY AND LEADERSHIP,38,377,404,372,78,4,384,1153
17K537,HIGH SCHOOL FOR YOUTH AND COMMUNITY DEVELOPMENT AT ERASMUS,73,338,349,340,85,1,342,1027
17K539,HIGH SCHOOL FOR SERVICE & LEARNING AT ERASMUS,61,362,375,368,78,3,368,1105
17K543,"SCIENCE, TECHNOLOGY AND RESEARCH EARLY COLLEGE HIGH SCHOOL AT ERASMUS",69,457,462,441,85,,453,1360
17K544,INTERNATIONAL ARTS BUSINESS SCHOOL,54,386,391,369,78,2,382,1146
17K546,HIGH SCHOOL FOR PUBLIC SERVICE: HEROES OF TOMORROW,79,418,441,414,,2,424,1273
17K547,BROOKLYN ACADEMY OF SCIENCE AND THE ENVIRONMENT,63,388,382,373,85,2,381,1143
17K548,BROOKLYN SCHOOL FOR MUSIC & THEATRE,48,385,393,373,78,1,384,1151
17K568,BROWNSVILLE ACADEMY HIGH SCHOOL,16,372,356,335,85,3,354,1063
17K590,MEDGAR EVERS COLLEGE PREPARATORY SCHOOL,165,476,481,479,78,3,479,1436
17K600,CLARA BARTON HIGH SCHOOL,259,425,413,413,85,,417,1251
17K625,PAUL ROBESON HIGH SCHOOL,53,365,363,355,92,4,361,1083
17K751,ACADEMY FOR HEALTH CAREERS,,,,,78,1,,0
18K563,IT TAKES A VILLAGE ACADEMY,56,313,320,330,85,4,321,963
18K566,BROOKLYN GENERATION SCHOOL,29,374,377,394,,1,382,1145
18K567,BROOKLYN THEATRE ARTS HIGH SCHOOL,54,383,358,377,78,1,373,1118
18K569,KURT HAHN EXPEDITIONARY LEARNING SCHOOL,43,368,378,346,85,2,364,1092
18K576,VICTORY COLLEGIATE HIGH SCHOOL,63,387,377,379,85,3,381,1143
18K578,BROOKLYN BRIDGE ACADEMY,17,384,362,351,92,2,366,1097
18K589,ARTS & MEDIA PREPARATORY ACADEMY,48,361,360,359,,,360,1080
18K617,HIGH SCHOOL FOR INNOVATION IN ADVERTISING AND MEDIA,37,404,393,386,78,3,394,1183
18K629,CULTURAL ACADEMY FOR THE ARTS AND SCIENCES,33,393,395,381,85,3,390,1169
18K633,HIGH SCHOOL FOR MEDICAL PROFESSIONS,75,386,380,393,,3,386,1159
18K635,OLYMPUS ACADEMY,7,400,370,370,85,4,380,1140
18K637,ACADEMY FOR CONSERVATION AND THE ENVIRONMENT,35,363,381,367,78,,370,1111
18K642,URBAN ACTION ACADEMY,40,376,385,374,92,2,378,1135
18K673,EAST BROOKLYN COMMUNITY HIGH SCHOOL,12,410,403,378,78,2,397,1191
19K409,EAST NEW YORK FAMILY ACADEMY,54,416,432,394,85,2,414,1242
19K420,FRANKLIN K. LANE HIGH SCHOOL,,,,,78,3,,0
19K431,THOMAS JEFFERSON YABC,,,,,92,2,,0
19K502,FDNY HIGH SCHOOL FOR FIRE AND LIFE SAFETY,37,341,349,333,78,4,341,1023
19K504,HIGH SCHOOL FOR CIVIL RIGHTS,47,363,349,342,85,1,351,1054
19K507,PERFORMING ARTS AND TECHNOLOGY HIGH SCHOOL,61,380,386,383,,1,383,1149
19K510,WORLD ACADEMY FOR TOTAL COMMUNITY HEALTH HIGH SCHOOL,68,371,365,370,85,3,369,1106
19K583,MULTICULTURAL HIGH SCHOOL,29,279,322,286,78,3,296,887
19K615,TRANSIT TECH CAREER AND TECHNICAL EDUCATION HIGH SCHOOL,182,395,418,380,78,,398,1193
19K618,ACADEMY OF INNOVATIVE TECHNOLOGY,60,371,371,354,78,4,365,1096
19K639,BROOKLYN LAB SCHOOL,57,360,385,363,85,1,369,1108
19K659,CYPRESS HILLS COLLEGIATE PREPARATORY SCHOOL,51,376,385,368,85,1,376,1129
19K660,W. H. MAXWELL CAREER AND TECHNICAL EDUCATION HIGH SCHOOL,74,370,369,363,78,4,367,1102
19K683,"THE SCHOOL FOR CLASSICS: AN ACADEMY OF THINKERS, WRITERS AND PERFORMERS",38,383,400,374,92,4,386,1157
20K445,NEW UTRECHT HIGH SCHOOL,456,402,471,399,85,4,424,1272
20K485,HIGH SCHOOL OF TELECOMMUNICATION ARTS AND TECHNOLOGY,238,425,474,424,,4,441,1323
20K490,FORT HAMILTON HIGH SCHOOL,694,417,478,411,85,1,435,1306
20K505,FRANKLIN DELANO ROOSEVELT HIGH SCHOOL,385,383,486,375,,3,415,1244
20K609,THE URBAN ASSEMBLY SCHOOL FOR CRIMINAL JUSTICE,,,,,78,,,0
20K658,FRANKLIN DELANO ROOSEVELT YABC,18,338,477,316,78,3,377,1131
21K337,INTERNATIONAL HIGH SCHOOL AT LAFAYETTE,54,326,386,314,85,4,342,1026
21K344,RACHEL CARSON HIGH SCHOOL FOR COASTAL STUDIES,54,402,427,408,92,4,412,1237
21K348,HIGH SCHOOL OF SPORTS MANAGEMENT,39,388,398,378,85,4,388,1164
21K410,ABRAHAM LINCOLN HIGH SCHOOL,475,396,437,393,78,2,409,1226
21K412/21K411,ABRAHAM LINCOLN YABC/LEARNING TO WORK GED AT ABRAHAM LINCOLN,,,,,78,4,,0
21K468,KINGSBOROUGH EARLY COLLEGE SCHOOL,,,,,78,3,,0
